product_title,COUNT(*)
Desser For Bedroom With 7 Fabric Drawers Organizer Storage Closet Chest Clothes For Living Room Display Cabinet Of Furniture,2
"Living Room Furniture, Modern 3-Piece Including Three-Seater, Loveseat and Single Chair,Dutch Velvet Upholstered Sofa Set",2
7-piece patio furniture set modular wicker outdoor sectioNAl sofa PE rattan outdoor set with pillowtop cushions and coffee table,2
Modern Small Bedside Table with Drawer Lock Nordic Minimalist Bedside Cabinet Storage Cabinets Nightstands for Bedroom Furnitur,2
Folding Desk Small Writing Desk Dressing Table Adjustable Height Space Saving Office Furniture Mobile Bookshelf,2
Simple Wardrobe Portable Large Capacity Assembly Storage Closet Bedroom Furniture Durable and Sturdy Clothes Dustproof Wardrobe,2
"3 Pieces Rocking Wicker Bistro Set, Patio Outdoor Furniture Conversation Sets with Porch Chairs and Glass Coffee Table, Beige",6
Outdoor Furniture Sets SectioNAl PE Rattan Outdoor Furniture Patio Conversation Set with Cushions for Balcony Lawn and Garden,3
"Patio Furniture Outdoor Set, Terrace Sofa Set, All-weather PE Rattan with Padded Cushions, Garden Furniture Sets",3
Makeup Table With 5 Drawers & Shelves Vanity Table Set Large Vanity Desk With Mirror and Lights White and Gold Bedroom Furniture,2
Dressers for Bedroom Furniture Thickened Frame Dresser Vanity Table for Makeup Furnitures Hallway Kids Room Make Up Table Toilet,2
"Sofa Bed Reversible Convertible Sleeper Pull Out Couches with Storage Chaise, Linen Fabric Furniture for Living Room, Apartment",2
Air Dresser LED White Vanity Set With Stool and Power Outlet Bedroom Furniture Home Makeup Vanity Table Girls(White) Furnitures,2
"Cushions for Patio Furniture Replacement, Patio Furniture Cushions, Deep Seat Cushions, Outdoor Seat Cushions",2
Makeup Vanity Table Set Glass Top Makeup Vanity Table With 10x Magnifying Mirror 3 Light Settings (Modern White) Furnitures Desk,5
"7 Pieces Patio Furniture Set, Modular Patio Set Wicker Outdoor SectioNAl Sofa Set PE Rattan Wicker Patio Conversation Set",3
Makeup Table Makeup Vanity With Lights Make Up Table 2 Cabinets & Long Storage Shelf Furniture Bathroom 10 Led Lights White Desk,5
Vanity Desk With Stool Makeup Vanity Table Set 3 Color Lighting Modes Brightness Adjustable Dressers for Bedroom Furniture Girls,4
Small Japanese Luxury Coffee Tables Unusual Entryways Modern Corner Coffee Table Cute Round Mesa De Centro Living Room Furniture,2
Dressing Table for Bedroom Furniture Home 4 Cabinets & Time Display Makeup Vanity Table Set Vanity Desk With Mirror and Lights,4
Side Bed Table With LED Light Bedside Tables for the Bedroom Furniture Generic Nightstand Set of 2 LED Nightstand With 2 Drawers,2
"Convertible SectioNAl Sofa,3 Seat L-Shaped Sofa with Linen Fabric,Movable Ottoman Small Couch,Living Room and Dark Gray Couch",2
"Patio Furniture Sets, 7 Piece PE Rattan Wicker Sofa Set, Outdoor SectioNAl Furniture Chair Set, Outdoor Furniture Sets",2
"Garden Furniture Set 7 PCS, Garden Fire Pit Table Patio Sets, No-Slip Cushions and Waterproof Covers, Garden Furniture Set",3
"4 Piece Patio Furniture Set, Outdoor Wicker Conversation Sets,Rattan SectioNAl Sofa w/Coffee Table, for Backyard Garden Poolside",2
"7 Pieces Patio Dining Set Outdoor Furniture with 6 Stackable Textilene Chairs and Large Table for Yard, Garden, Porch , Grey",2
"Redlife Vanity Stool Chair with Storage Faux Fur Makeup Ottoman, Dresser Furniture with Gold Metal Legs for Bedroom & Livingroom",2
"Garden Furniture 8 Pieces Set with 40 inches Fire Pit Outdoor Sofa Sets, Wicker Furniture Set with Coffee Table, Garden Furniture Sets",2
Home Furniture Storage Cabinet Office Chairs for Living Room Shoerack Shoe Organizer Rack Chaise Lounge Shoe-shelf Canopy Shoes,2
"Patio Furniture Set, 7 Pieces Outdoor Patio Furniture with Dining Table&Chair, All Weather Wicker Conversation Set with Ottoman",2
Portability Foot Rest Under Desk Footrest Ergonomic Foot Stool with Massage Rollers Foot Rest for Home Office Work Fast Ship,2
"MUMUCC MultifunctioNAl Foldable And Adjustable Aluminum Alloy Reading Stand With Spring Clip For Laptops, Tablets & Thick Books",2
"3 in 1 Sleeper Sofa Couch Bed with USB & Type C Port, 52 inches Small Modern Convertible Tufted Velvet Loveseat Sofa w/Pull Out Bed",2
"king size bed frame, with 4 storage drawers, Upholstered Platform Bed Frame, Solid wood slat support, No box spring required",2
"Vanity Makeup Mirror Desk with Stool,Makeup Vanity Set with 6 Drawers and Shelves,Vanity Table with Power Strip",2
"White Vanity Desk with Mirror, Lights and Charging Station - Large Makeup Table Set with RGB Cabinets and 3 LED Light Modes",4
"Modern LED TV Stand for Televisions up to 70 Inch with Glass Shelves and Drawer, Gaming Entertainment Center with Multiple",2
LEEGOHOME Wardrobe 105x45x170cm 26mm Painted Alloy Steel Pipe ABS Interface Wholesale Purchasing Cloth Wardrobe 5-7Days Delivery,2
"Convertible SectioNAl 3 L-Shaped Couch Soft Seat with Modern Linen Fabric, Space-Saving Sofas for Living Room, Apartment, 70''",2
"Bedstead Headboard with 2 Layers of Storage, Metal Platform Bed Frame with 4 Storage Drawers, Built-in Charging Station and LED",2
"Dresses 10 Drawers, Bedroom Chest of Drawers with Side Pockets and Hooks, Sturdy Steel-framed Vanity, PU Storage Dresses",2
Dresser for Bedroom With 8 Drawer Dressing Table TV Stand Dressers Chest of Drawers for Living Room Hallway Entryway White the,2
European Style Bedside Modern Minimalist Mini Storage Rack Living Room Small Square Table Magazine Table Small Coffee Table,2
New Wholesale Simple Shoe Rack Multi-layer Space-saving DIY Household Organizer Multi-functioNAl Economic Shoe Storage Racks,2
Small Gaming Desk with Power Outlets LED Light 43 Inch L Shaped Computer Desk with Monitor Stand Storage Shelves Reversible,2
"Vanity Table Set with Mirror 2 Storage Drawer Makeup Desk Cushioned Stool Set Modern Dressing Vanity Table for Bedroom, White",2
PP Folding Stools Portable Lightweight Chairs For Picnic BBQ Beach Bathroom Kitchen Office Garden Camping Fishing Outdoor,2
"Footstool, Modern Velvet Round, Powder Room Makeup Chair, Makeup Bench Footstool with Gold Legs Modern Feature Footstool",2
Dresser for Bedroom with 12 Drawers Tall Dressers & Chests of Drawers for Bedroom Dresser for Closet Wooden Top & Metal Frame,2
Computer Armchair Girlfriend Computer Gaming Chair Pink Gaming Chair With Footrest Sister Wife and Love (Pink) Desk Gamer Office,2
Double door folding simple cloth wardrobe thickened and thickened 19mm steel pipe single person storage wardrobe,2
Acrylic Transparent Coffee Table Clear Drink Table Small Round End Modern Living Room Side Table Acrylic desk Home Decorations,2
"Outdoor Sofa Four Piece Set, with Soft Cushion and Tempered Glass Table, Willow Wicker Garden Sofa",2
"67 Inch Large Capacity Portable Closet Wardrobe with Non-Woven Fabric Cover, 4 Hanging Rods, 8 Shelves - Black Clothes Storage",2
3-Seat Swing Seat and Ceiling Cover Garden Swing Hammock Tent Waterproof UV Protection Courtyard Swing Cover (not include swing),2
Acrylic Drink Table Clear Small Round End Table For Drinks Modern Living Room Side Table For Drinks SNAcks Phones Coffee Drink,2
Wooden Outdoor Folding Picnic Table Portable Holder Round Foldable Desk Wine Glass Rack Collapsible Table For Garden Party,2
Folding Stool Stepladder Easy To Hold Lightweight Indoor Outdoor Travel Bath Easy To Carry Children Adults Non-slip,2
Simple Shoe Rack Multi-Layer Space Saving Shoe Rack DIY Home Use MultifunctioNAl Organizer MultifunctioNAl Economic Shoe Rack,2
LEEGOHOME Wardrobe 170x45x170cm 26mm Painted Alloy Steel Pipe ABS Interface Wholesale Purchasing Cloth Wardrobe 5-7Days Delivery,2
"Dining Table Set for 6,Farmhouse Kitchen Table Set with 4 Upholstered Chairs and 1 Bench,Solid Wood Dining Table Set for Kitchen",2
"5-Piece Patio Furniture Set Outdoor Couch with Glass Coffee Table and Two Pillows, Outdoor SectioNAl Conversation Set",2
TV Stand Dresser For Bedroom With 5 Fabric Drawers Organizer Storage Closet Chest Clothes Storage Display Cabinet Of Furniture,2
"3 PCS Patio Conversation Set, Solid Eucalyptus Wood Frame Outdoor Wicker Furniture Set Bistro Set with Coffee Table",2
"Patio Furniture Sets - 3 Pieces Rattan Sofa Set, Outdoor Conversation Set with Tempered Glass Tabletop, Outdoor Furniture Sets",3
7 Pieces Patio Furniture Set - Outdoor SectioNAl Wicker Rattan Furniture with Cushion and Glass Table Patio Conversation,2
"4-Piece Outdoor Patio Furniture Set,Wicker Rattan SectioNAl Sofa Couch with Glass Coffee Table|Black Easy Cleaning and Stronger",2
5 Pieces Patio Furniture Set Outdoor SectioNAl Rattan Daybed Conversation Sofa Set Wicker Couch with & Tempered Glass,2
6Pieces Wicker Patio Furniture Sets Outdoor Conversation Set PE Rattan SectioNAl Sofa Couch with 30 inches Fire Pit Table and Cushions,2
"Aluminum Patio Furniture Set, Modern Patio Conversation Set, All Weather Dark Grey Outdoor SectioNAl Sofa Set w/Table",2
"5 Piece Patio Furniture Set, Outdoor Dining Table Set with L-Shaped SectioNAl Sofa, 2 Ottomans, Outside Conversation",2
"Greesum 3 Pieces Patio Furniture Set Outdoor Conversation Textilene Fabric Chairs for Garden,Balcony, with A Glass Coffee Table",2
Makeup Vanity Organizer Makeup Vanity Desk With Mirror and Lights Dressers for Bedroom Furniture 5 Drawers & Storage Bag Dresser,4
"3 Pieces Patio Furniture PE Rattan Wicker Chair Conversation Set, 26.6x12.1x19.3 inches, Assemble Easily, Sturdy&Durable",3
"Wisteria Lane Outdoor Patio Furniture Set, 7-Piece Outdoor Dining Sofa Set with Dining Table and Chairs with Footstool",2
"Patio Furniture L-Shaped Coversation SectioNAl Outdoor Sofa Set for Backyard, Porch with Thick Cushions Detachable Lounger",2
"5 Pcs Patio Furniture Sets, Wicker Patio Furniture Set with Washable Cushions & Glass Coffee Table for Garden, Poolside",2
"7 Pieces Patio Furniture Set, Outdoor SectioNAl Sofa Conversation Set, All Weather Wicker Rattan Couch Dining Table & Chair",2
"6 Piece Patio Furniture Set, Outdoor SectioNAl Conversation Rattan Sofa Set with Ottoman and Outdoor Storage Table",2
"Convertible Sofa Bed, 3-in-1 Multi-FunctioNAl Velvet Sleeper Couch Pull-Out Bed Hidden Side Table for Living Room, Small Space",2
"LostCat Buffet Sideboard,Console Table with Storage,with 4 Drawers and Cabinets,Easy Assmebly for Kitchen,Dining Room",2
Armoire Wardrobe Closet - White 32 inchesW x 35 inchesH x 20 inchesD Cabinet for FunctioNAl Clothes Storage with Hanging Rail home furniture,2
Retro Sideboard Glass Door with Curved Line Design Ample Storage Cabinet with Black Handle and Three Adjustable Shelves,2
"3 Pieces Patio Furniture Set Outdoor Conversation Textilene Fabric Chairs for Lawn, Garden, Balcony, Poolside",2
"Living Room Sofa,Beige Linen Modern 3 Seater L Shaped Upholstered Furniture,Reversible Footrest with Storage Sofa",2
"Walker Edison Modern ScandiNAvian Fluted Door Kitchen Storage Sideboard Buffet Cabinet Console, 69 Inch, Coastal Oak/Black",2
Sofas for Home Furniture Velvet Upholstered 2 Seater Couch with Square Arms and Tufted Back Sofa Living Room Sofas,2
"Side Table,Modern end Table,Metal nightstand,Bedside Tables,Accent Table with Storage for Living Room Bedroom entryway Couch",2
"Sausalito Chairs for Living Room Furniture, Reading, Arm, Comfy, Small Accent Bedroom, Velvet Pearl Beige",2
"Wicker Patio Furniture Set for 4, Beige Cushions, Outdoor Modern SectioNAl Conversation Sofa Set for Deck",2
31.5in(L)… Home Furniture Luxury Cute Vanity Makeup Table Vanity Desk With Mirror and Lights 3 Lighting Modes Dresser Furnitures,2
Modern Lift Top Coffee Table Wooden Furniture with Storage Shelf and Hidden Compartment for Living Room Office,2
"Garden Furniture Sets, Outdoor PE Rattan Lounge Daybed with Retractable Canopy & 2 Folding Side Trays, Patio Furniture Set",3
6-Drawer Double Dresser Make Up Table Pure Black With Brushed Nickel Handles Vanity Desk Women's Furniture Makeup Dressing Table,2
"LIKIMIO Small Makeup Vanity Desk with Mirror and Lights, Vanity Table Set with Storage Drawer & Chair & 3 Shelves, Bedroom",4
"8 Pieces Outdoor Wicker Rattan Patio Furniture SectioNAl Set,Glass Top Table Hidden Storage,7 Sofa Sections, Oversized Cushions",2
LED TV Stand for TV Up to 75 inches Entertainment Center W/Outlets & USB Ports Media Console Cabinet W/Storage White Furniture Table,2
"Modern Vanity Desk with Lighted Mirror, Desk Makeup Dressing Table with Power Strip, 12 LED Lights, 1 Large Drawers",2
"SectioNAl Convertible Sofa, L-Shaped 5-Seats SectioNAl Convertible Sofa",2
LEEGOHOME Wardrobes Closet armario Cloth Bedroom Furniture 85/125/166/207x45x170cm 26mm Steel Pipe Support Storage Household,2
"Patio Furniture Set 4 Piece with Egg Chair and Ice Bucket, Small L Shape Wicker Conversation SectioNAl Sofa Set",2
"Patio Furniture Sets, 6 Pieces Couch Outdoor Chairs Coffee Table Peacock Blue Anti-Slip Cushions, Outdoor Furniture Sets",3
"Sofa SectioNAl Sofa with Chaise Longue, Haussmann, 2 Pillows,for Living Room Furniture,L-shaped Faux Leather SectioNAl Couch Set",2
9 Pieces Dining Outdoor Furniture Patio Wicker Rattan Chairs and Tempered Glass Table SectioNAl Conversation Set,3
"4-Piece Modern Aluminum Patio Furniture Sets,Faux Wood Grain Finish Frame Sofa with Removable Extra Thick Cushions and Table",2
Patio Furniture 4 Pieces Conversation Sets Outdoor Wicker Rattan Chairs Garden Backyard Balcony Porch Poolside loveseat with,2
7 Piece Terrace Dining Outdoor Furniture Set with Weatherproof Table and 6 Stackable for Garden,2
Living Room Dressers for Bedroom Furniture Chest of Drawers With Steel Frame Toiletries Wood Top for Nursery Fabric Dresser Desk,2
L Shaped Computer Desk Wood Corner PC Gaming Table With Side Storage Bag for Home Office Small Spaces Room Desks Furniture Study,2
"Courtyard patio furniture set, 4-piece outdoor patio set with sofa, removable & washable deep seating cushion, tempered glass Ta",2
"Patio Furniture Sets, 6 Piece Small Patio Set, All Weather PE Wicker Rattan Outdoor SectioNAl Sofa Couch, Outdoor Furniture Sets",2
Dressers for Bedroom Furniture Office Organization and Storage Furnitures 7 Drawer) Vanity Desk Dressing Table 5/7 Drawer Chest,2
"3 Pieces Patio Wicker Furniture Set, Rattan Outdoor Sofa Set w/Washable Cushion & Acacia Wood Coffee Table, for Garden Backyard",2
7 Pieces Outdoor PE Wicker Furniture Set Patio Rattan SectioNAl Conversation Sofa Set with Khaki Cushions and Glass Top Table,2
Makeup Vanity Desk Set Pearl-White 3 Color Lighting Modes Make Up Table Makeup Vanity With Large Lighted Mirror Furnitures Light,3
"16 Drawers Dresser for Bedroom, Tall Dressers & Chests of Drawers with Wood Top, Large Fabric Storage Dresser,Black",2
"Modern furniture, simple custom furniture",2
6/7 Drawers Dresser Wooden Storage Dressers Chests of Drawers for Bedroom Home,2
32 Pairs Shoe Organizer Cabinet 8 Cube 16 Tiers Shoe Rack with Clear Door Plastic Storage System Free Standing Rack Organizing,2
"Dresser for Bedroom with 12 Drawers, Chest of Drawers with Side Pockets and Hooks, PU Fabric Dresser Drawers for Living Room",2
"Harvey Park Dresser, L: 60.71 inches x W: 17.48 inches x H: 31.06 inches, Soft White finish",2
"Chaise longue upholstered in linen, 1-person sofa spike head upholstery, suitable for living room and bedroom, cream beige",2
"Nightstand with Power Outlet and LED Light, Side End Table with Storage Cabinet, Modern Bedside Table for Bedroom, Living Room",2
"Vanity Table Set with Lighted Mirror - Makeup Vanity with Lights, Adjustable Brightness, Large Drawer Sturdy Wood Vanity",2
"Makeup Vanity with Lights, Vanity Desk with Charging Station, Black Vanity Table with 10 Light Bulbs Mirror & 3 Lighting Modes",2
Caterpillar Single Sofa Lazy Couch Tatami Living Room Bedroom Lovely Leisure Single Chair Reading Chair Balcony Rocking Chair,2
Modern Rectangle Wood Coffee Table with Storage Living Room 42 inches L x 21 inches W x 17 inches H Compact Design Ample Storage Capacity Robust,2
"Yaheetech Sherpa Fabric Accent Chair, Modern Cozy Vanity Chair with Gold Metal Legs, Boucle Fabric Armchair with Removable Seat",2
"Makeup Vanity Desk with HD Lighted Mirror, Mirror and Lights, Dressing Table with Drawers & Shelves, Glass Top for Bedroom",2
"Office Chair Height-Adjustable Ergonomic Desk Chair with Lumbar Support, Breathable Mesh Computer Chair High Back Swivel Task",2
"8 Dresser TV Stand with Power Outlet & LED for 55'' TV, Long Dresser for Bedroom with 8 Deep Drawers, Wide Console Table",2
"Nightstands Set of 2 with LED Lights and Charging Station,End Table with 2 Fabric Storage Drawers and Shelves, Modern Side Table",2
"Swing for Patio and Garden, Heavy Swing Chair Bench with Outdoor Hanging Chain, Upgraded Patio Wooden Porch Swing",2
Computer Chair Office Chair High Back Ergonomic Office Chair With Lumbar Support Adjustable Headrest 3D Armrest and Lumbar Gamer,2
"6 Drawer Dresser White Dresser, 51'' Tall Dresser White/Black and Gold Dresser with Exquisite Glass Door, Modern Dresser",2
Home Office Chair Ergonomic Desk Chairs Mesh Computer with Lumbar Support Armrest Rolling Swivel Adjustable Black,2
Portable Wardrobe Closet Storage Organizer Large Capacity 20 inchesDeep Portable Plastic Closet Armoire Collapsible Organizer Wardrobe,2
"Egg Swing Chair with Stand, Rattan Wicker Hanging Egg Chair for Indoor Outdoor Bedroom Patio Hanging Basket Chair Hammock",2
"32 inches Storage Cabinet, Drifted Gray Storage Cabinet, Bathroom Cabinet, Pantry Cabinet with 3 Shelves 16 inches D x 32 inches W x 65 inches H",2
"Modern TV Stand Entertainment Center with Two Storage Cabinets, Retro Style Media Console for Living Room, Bedroom, Office",2
Elite 32 inchesW x 35 inchesH x 20 inchesD White Wardrobe Closet & Cabinet - FunctioNAl Clothes Storage with Hanging Rail,2
Set of 2 Nightstand Charging Station End Side Table Flip Storage Drawer Bedroom Bedside Table,2
"Modern Dresser for Bedroom, 6/9 Drawer Dresser with Metal Handles, Wood Floor Storage Chest ,for Living Room, White & Black",2
"Modern Makeup Vanity Desk with Glossy Desktop,Bedroom Home Office Writing Desk with Drawers, for Dressing Table Without Mirror",2
Recliner Chair for Living Room Massage Recliner Sofa Reading Chair Single Sofa Home Theater Seating Modern Reclining Chair,2
"Small Dresser with 5 Drawers for Closet,Organizer Unit for Bedroom, Living Room & Closets,Dresser for Bedroom,",2
"Modern Ottoman Velvet Footstool Bench for Bedroom, Pink",2
"2023 New 3 Drawer Sliding Barrel Modern Bedroom Nightstand, White",2
"Queen Bed Frame with Headboard,Linen Upholstered with Wood Slats Support,No Box Spring Needed,Dark Grey Bed Frame",2
"JHSafer 30 Inches Folding Storage Ottoman Bench, Fireproof Storage Chest Foot Rest Stool with Lock, Storage Bench with Handle f",2
"Flower Shape Velvet Armchair, Modern Side Chair Vanity Chair with Golden Metal Legs for Living Room/Dressing Room/Bedroom/Home",2
"TV Stand, Deformable TV Stand with LED Lights & Power Outlets, Modern TV Stand for 45/50/55/60/65/75 Inch TVS,",2
"Dresser for Bedroom with 3 Drawer, Modern Dressers Chest of Drawers, with Wide Drawers and Metal Handles, Wood Dressers, White",2
56.6?W Modern Loveseat 2 Seater Sofa Luxurious Velvet Fabric Couch Futon with Gold-Tone Metal Arms and Legs Sofa,3
"Modern Tuft Futon Couch Convertible Loveseat Sleeper Reclining Sofa Bed Twin Size with Arms and 2 Pillows for Living Room, Black",2
"Twin-Over-Twin Bunk Bed Espresso Converts To 2 Individual Twin Beds, Getting Up and Down in Bed",2
"Shoe Cabinet with 3 Clamshell Drawers, Modern Slim Hidden Shoe Storage and Freestanding Tipper Rack with NArrow Entry Grey",2
"Fabric Dresser for Bedroom, Storage Drawer Unit,Dressers with 10 Deep Drawers for Office,White Vanity Desk",2
"Velvet Futon Sofa Bed, 73-inch Sleeper Couch with 3 Reclining Angles, Living Room Loveseat Sofa Two Pillows (Cream White Velvet)",2
"LED Nightstand with Wireless Charging Station & USB Ports, Bedside Tables with 2 Drawers, with 3 Color & Adjustable Brightness",2
"LED TV Stand for Up 50 to 70 Inch, TVs Entertainment Center Table Stands with 2 Storage and 3 Open Shelves High Gloss, TV Stand",2
"AMERLIFE Makeup Vanity Table Set with Sliding & LED Lighted Mirror, 45 inches Large Vanity with Charging Station, 4 Drawers",2
"Large Modern Dining Table for 6-8 People, Rectangular Kitchen Table with Faux Marble Top, Gold Geometric Metal Legs, 70.3 in",2
"Large Wardrobe Armoire Closet with 3 Doors, Freestanding Wardrobe Cabinet for Hanging Clothes, Bedroom Armoire Dresser Wardrobe",2
US Shoe Rack Large Capacity Boot Storage 12 Cube Organzie Modular DIY Plastic 6 Tier 24-96 Pairs of Shoe Tower Cabine,2
"104 inches Linen Fabric Sofa with Armrest Pockets and 4 Pillows, Minimalist Style 4-Seater Couch for Living Room, Apartment, Gray",2
No Box Spring Needed Platform Bed Bases & Frames Leather Upholstered Headboard 3 Storage Drawers Bed Foundation Frame Black Home,2
"Floating Bed Frame Queen Size with LED Lights,Metal Platform, No Box Spring Needed, Easy to Assemble Queen Bed Frame",2
Computer Desk - Gaming Corner Office Writing Wooden Table Desk,2
"Queen Size Bed Frame,Metal Platform 14 Inch Beds Frames-Mattress Foundation,Steel Slat Black Queen Bed Frame,",2
"2 Door Wood Wardrobe Bedroom Closet with Clothing Rod inside Cabinet, 2 Drawers for Storage and Mirror, White",2
Cloud Living Room Coffee Table High Gloss Storage Nordic Household Simple Modern Tea Table Small Apartment Black Table,2
"Dresser, Make-up Dresser with IllumiNAted Mirror, with Stool Set, with Drawer, with 3 Lighting Modes, Dresser Set",2
"Gizoon 5 Piece Glass Dining Table Set, Kitchen and Chairs for 4, PU Leather Modern Room Sets Home (Black)",2
Small Shoes Changing Stool Living Room Simple Fabric Low Stools Repose-pieds Footstool Soft Bag Footrest Stool With Wood Legs,2
"Garden Furniture 7 Pieces Set, Patio Furniture PE Wicker Sets with Washable Cushions Glas Coffee Table, Garden Furniture Set",2
